question_en,question_dk,answer_en,answer_dk
"Can I download the graphs to use in PowerPoint, Word, etc.?","Kan jeg downloade graferne til at bruge i PowerPoint, Word osv.?","Yes, you can download by either clicking on the 'Download' button below the graph.","Ja, du kan downloade graferne enten ved at klikke på 'Download'-knappen under den pågældende graf."
"Why are some data presented as 3-year moving averages, but others are not?","Hvorfor er noget data præsenteret som 3-års glidende gennemsnit, mens andet ikke er?","This is done because some analyses with very few observations may appear to swing wildly from one year to the next due to small, random fluctuations in the data. Averaging over several years smooths out this noise.","Det forholder sig sådan, fordi nogle af analyserne har meget få observationer og kan derfor variere meget fra ét år til et andet pga. små, tilfældige udsving i data. Ved at lave et gennemsnit over flere år bliver denne variation således udjævnet."
Can I download the data?,Kan jeg downloade data?,"Yes, you can download each table as either a PDF document, or a MS Excel spreadsheet","Ja, du kan downloade hver tabel som enten en PDF-fil eller en Excel-fil."
Why do you use 'age-standardized rates' instead of simply showing the unadjusted rates?,Hvorfor bruger I aldersstandardiserede rater i stedet for bare at vise de ujusterede rater?,"This is done to account for different age distributions when comparing different groups (e.g. education groups, municipalities, regions, and ethnicities). Older people are more likely to have a heart disease than younger people, so if we compare one group of people who are younger (on average) with another group who are older, then we need to account for this difference in age to make a proper comparison of heart diseases between the two groups. Otherwise, it will appear that the group that is older has a higher rate of heart diseases, simply because of age.","Dette er gjort for at tage højde for de forskellige fordelinger i alder, når man sammenligner forskellige grupper (f.eks. uddannelsesgrupper, kommuner, regioner og etnicitet). Ældre personer har større risiko for at have en hjerte-kar-sygdom end yngre personer, så hvis man sammenligner én gruppe af personer, der er yngre (i gennemsnit), med en anden gruppe af personer, der er ældre, bliver vi nødt til at tage højde for denne aldersforskel for at lave en passende sammenligning af hjerte-kar-sygdomme mellem de to grupper. Hvis vi ikke tog højde for aldersforskelle, ville det se ud som om, den ældre gruppe af personer havde en højere rate af hjerte-kar-sygdomme kun på grund af alderen."
Why do some cells in the  tables show 'NA'?,Hvorfor står der 'NA' i nogle af cellerne i tabellerne?,"This happens when there are too few observations to make a rate calculation. We do not show data when there are fewer than 10 observations in a cell, or fewer than 4 observations for 3-year moving average tables. 'NA' stands for 'Not applicable'","Dette sker, når der er for få observationer til at lave udregninger for en rate. Vi viser ikke data, når der er færre end 10 observationer i en celle eller færre end fire observationer for tabellerne med 3-års glidende gennemsnit. 'NA' står for 'Not applicable' (ikke anvendelig)."
"When I compare tables (e.g. 'Age' and 'Region'), the totals are different. Shouldn't they be the same in all tables?","Når jeg sammenligner tabellerne (f.eks. 'Alder' og 'Region'), er totalerne forskellige. Burde de ikke være de samme i alle tabeller?","Not necessarily. We don't have complete data on every person in Denmark, so some people may be missing from some of the registries. For example, if we have data on how old someone is, but are missing data on where they live, they will appear in the 'Age' tables, but not in the 'Region' tables.","Ikke nødvendigvis. Vi har ikke al data for hver person i Danmark, så nogle personer kan mangle i nogle registre. Hvis vi f.eks. har data på, hvor gamle nogen er, men mangler data for hvor de bor, vil de fremgå i tabellerne under 'Alder', men ikke i tabellerne under 'Region'."
Why do the education graphs and tables only show data for people aged 35 - 79?,Hvorfor viser graferne og tabellerne under 'Uddannelse' kun personer mellem 35 - 79 år?,The registries are missing too much education data for people in older age groups this to make any meaningful analyses.,"Vi mangler for meget data om uddannelse for personer i ældre aldersgrupper, så det er ikke meningsfuldt at lave analyser for disse."
Why can I not see all the statistics for all diseases (i.e. 30-day mortality)?,Hvorfor kan jeg ikke se alle statistikkerne for alle sygdomme (f.eks. for 30 dages-dødelighed)?,"This happens when there are too few observations to make a meaningful analysis. This can be due to the fact that the outcome is rare (i.e. if most people who had the selected disease do not have the outcome), or the population is too small (i.e. there aren't many people who get the selected disease), or a combination of both these reasons.","Dette sker, når der er for få observationer til at lave en meningsfuld analyse. Dette kan skyldes, at udfaldet er sjældent (f.eks. hvis de fleste mennesker, der havde den pågældende sygdom, ikke havde noget udfald), at populationen er for lille (f.eks. hvis der ikke er særligt mange mennesker, der får den pågældende sygdom) eller en kombination af disse to årsager."
